{
    "name": "get whole data directory",
    "yangdirs": [ "../../yang-models/example_1" ],
    "model": "../../yang-models/example_1/example1.json",
    "before": "state.json",
    "query": {
        "operation": "GET",
        "url": "/data/ex353:top",
        "headers": {
            "Accept": "application/yang-data+json"
        },
        "body": null
    },
    "response": {
        "status": 200,
        "headers": {
            "Content-Type": "application/yang-data+json"
        },
        "body": "result.json"
    },
    "after": "state.json"
}
