{
    "name": "RFC 8040 Section 3.3.3. json example",
    "yangdirs": [ "../../yang-models/rfc8040-jukebox" ],
    "model": "../../yang-models/rfc8040-jukebox/jukebox.json",
    "before": "state.json",
    "query": {
        "operation": "GET",
        "url": "/yang-library-version",
        "headers": {
            "Accept": "application/yang-data+json"
        },
        "body": null
    },
    "response": {
        "status": 200,
        "headers": {
            "Content-Type": "application/yang-data+json"
        },
        "body": "result.json"
    },
    "after": "state.json"
}
