{
    "name": "RFC 8040 Section 3.3.1. xml example",
    "yangdirs": [ "../../yang-models/rfc8040-jukebox" ],
    "model": "../../yang-models/rfc8040-jukebox/jukebox.json",
    "before": "state.json",
    "query": {
        "operation": "GET",
        "url": "/data/example-jukebox:jukebox/library?content=nonconfig",
        "headers": {
            "Accept": "application/yang-data+xml"
        },
        "body": null
    },
    "response": {
        "status": 200,
        "headers": {
            "Content-Type": "application/yang-data+xml"
        },
        "body": "result.xml"
    },
    "after": "state.json"
}
