{
    "name": "RFC 8040 Section B.3.2. depth=unlimited json example",
    "yangdirs": [ "../../yang-models/rfc8040-jukebox" ],
    "model": "../../yang-models/rfc8040-jukebox/library.json",
    "before": "state.json",
    "query": {
        "operation": "GET",
        "url": "/data/example-jukebox:jukebox?depth=unbounded",
        "headers": {
            "Accept": "application/yang-data+json"
        },
        "body": null
    },
    "response": {
        "status": 200,
        "headers": {
            "Content-Type": "application/yang-data+json"
        },
        "body": "state.json"
    },
    "after": "state.json"
}
