{
    "name": "RFC 8040 Section B.1.2. json example",
    "yangdirs": [ "../../yang-models/rfc8040-jukebox" ],
    "model": "../../yang-models/rfc8040-jukebox/jukebox.json",
    "before": "before.json",
    "query": {
        "operation": "GET",
        "url": "/data/ietf-yang-library:modules-state",
        "headers": {
            "Accept": "application/yang-data+json"
        },
        "body": null
    },
    "response": {
        "status": 200,
        "headers": {
            "Content-Type": "application/yang-data+json"
        },
        "body": "response.json"
    },
    "after": "after.json"
}
